{
  "title": "Finder Vim Controls",
  "homepage": "https://github.com/chrisgrieser/dotfiles/karabiner",
  "maintainers": [
    "pseudometa (chrisgrieser)"
  ],
  "anchors": [
    {
      "conditions": [
        {
          "type": "frontmost_application_if",
          "bundle_identifiers": [
            "^com\\.apple\\.finder$"
          ]
        },
        {
          "type": "frontmost_application_if",
          "bundle_identifiers": [
            "^com\\.runningwithcrayons\\.Alfred$",
            "^com\\.apple\\.finder$"
          ]
        },
        {
          "type": "input_source_if",
          "input_sources": [
            {
              "language": "^de$"
            }
          ]
        },
        {
          "type": "input_source_unless",
          "input_sources": [
            {
              "language": "^de$"
            }
          ]
        },
        {
          "type": "variable_if",
          "name": "FINDER_INSERT_MODE",
          "value": true
        },
        {
          "type": "variable_unless",
          "name": "FINDER_INSERT_MODE",
          "value": true
        },
        {
          "type": "variable_if",
          "name": "FINDER_FIND_MODE",
          "value": true
        },
        {
          "type": "variable_unless",
          "name": "FINDER_FIND_MODE",
          "value": true
        },
        {
          "type": "variable_if",
          "name": "FINDER_ALFRED_ACTIVE",
          "value": true
        },
        {
          "type": "variable_unless",
          "name": "FINDER_ALFRED_ACTIVE",
          "value": true
        },
        {
          "type": "variable_if",
          "name": "FINDER_MOVE_ACTIVE",
          "value": true
        },
        {
          "type": "variable_unless",
          "name": "FINDER_MOVE_ACTIVE",
          "value": true
        },
        {
          "type": "variable_if",
          "name": "FINDER_CONTEXT_MENU_ACTIVE",
          "value": true
        },
        {
          "type": "variable_unless",
          "name": "FINDER_CONTEXT_MENU_ACTIVE",
          "value": true
        }
      ]
    },
    {
      "to": [
        {
          "set_variable": {
            "name": "FINDER_INSERT_MODE",
            "value": true
          }
        },
        {
          "set_variable": {
            "name": "FINDER_INSERT_MODE",
            "value": false
          }
        },
        {
          "set_notification_message": {
            "id": "insert-notice",
            "text": "‚úèÔ∏è  INSERT"
          }
        },
        {
          "set_notification_message": {
            "id": "insert-notice",
            "text": ""
          }
        },
        {
          "set_variable": {
            "name": "FINDER_FIND_MODE",
            "value": true
          }
        },
        {
          "set_variable": {
            "name": "FINDER_FIND_MODE",
            "value": false
          }
        },
        {
          "set_notification_message": {
            "id": "find-notice",
            "text": "üîç FIND"
          }
        },
        {
          "set_notification_message": {
            "id": "find-notice",
            "text": ""
          }
        },
        {
          "set_notification_message": {
            "id": "move-notice",
            "text": ""
          }
        },
        {
          "set_notification_message": {
            "id": "move-notice",
            "text": "‚úÇÔ∏è  Move active"
          }
        },
        {
          "set_variable": {
            "name": "FINDER_ALFRED_ACTIVE",
            "value": true
          }
        },
        {
          "set_variable": {
            "name": "FINDER_ALFRED_ACTIVE",
            "value": false
          }
        },
        {
          "set_variable": {
            "name": "FINDER_MOVE_ACTIVE",
            "value": true
          }
        },
        {
          "set_variable": {
            "name": "FINDER_MOVE_ACTIVE",
            "value": false
          }
        },
        {
          "set_variable": {
            "name": "FINDER_CONTEXT_MENU_ACTIVE",
            "value": true
          }
        },
        {
          "set_variable": {
            "name": "FINDER_CONTEXT_MENU_ACTIVE",
            "value": false
          }
        }
      ]
    }
  ],
  "rules": [
    {
      "description": "Finder Vim Controls",
      "manipulators": [
        {
          "type": "basic",
          "from": {
            "key_code": "j"
          },
          "to": [
            {
              "key_code": "down_arrow"
            }
          ],
          "conditions": [
            {
              "type": "frontmost_application_if",
              "bundle_identifiers": [
                "^com\\.apple\\.finder$"
              ]
            },
            {
              "type": "variable_unless",
              "name": "FINDER_INSERT_MODE",
              "value": true
            },
            {
              "type": "variable_unless",
              "name": "FINDER_FIND_MODE",
              "value": true
            }
          ]
        },
        {
          "type": "basic",
          "from": {
            "key_code": "k"
          },
          "to": [
            {
              "key_code": "up_arrow"
            }
          ],
          "conditions": [
            {
              "type": "frontmost_application_if",
              "bundle_identifiers": [
                "^com\\.apple\\.finder$"
              ]
            },
            {
              "type": "variable_unless",
              "name": "FINDER_INSERT_MODE",
              "value": true
            },
            {
              "type": "variable_unless",
              "name": "FINDER_FIND_MODE",
              "value": true
            }
          ]
        },
        {
          "type": "basic",
          "from": {
            "key_code": "h"
          },
          "to_if_alone": [
            {
              "key_code": "up_arrow",
              "modifiers": [
                "command"
              ]
            }
          ],
          "conditions": [
            {
              "type": "frontmost_application_if",
              "bundle_identifiers": [
                "^com\\.apple\\.finder$"
              ]
            },
            {
              "type": "variable_unless",
              "name": "FINDER_INSERT_MODE",
              "value": true
            },
            {
              "type": "variable_unless",
              "name": "FINDER_FIND_MODE",
              "value": true
            },
            {
              "type": "variable_unless",
              "name": "FINDER_CONTEXT_MENU_ACTIVE",
              "value": true
            }
          ]
        },
        {
          "type": "basic",
          "from": {
            "key_code": "l"
          },
          "to_if_alone": [
            {
              "key_code": "down_arrow",
              "modifiers": [
                "command"
              ]
            }
          ],
          "conditions": [
            {
              "type": "frontmost_application_if",
              "bundle_identifiers": [
                "^com\\.apple\\.finder$"
              ]
            },
            {
              "type": "variable_unless",
              "name": "FINDER_INSERT_MODE",
              "value": true
            },
            {
              "type": "variable_unless",
              "name": "FINDER_FIND_MODE",
              "value": true
            },
            {
              "type": "variable_unless",
              "name": "FINDER_CONTEXT_MENU_ACTIVE",
              "value": true
            }
          ]
        },
        {
          "type": "basic",
          "from": {
            "key_code": "g"
          },
          "to": [
            {
              "key_code": "up_arrow",
              "modifiers": [
                "option"
              ]
            }
          ],
          "conditions": [
            {
              "type": "frontmost_application_if",
              "bundle_identifiers": [
                "^com\\.apple\\.finder$"
              ]
            },
            {
              "type": "variable_unless",
              "name": "FINDER_INSERT_MODE",
              "value": true
            },
            {
              "type": "variable_unless",
              "name": "FINDER_FIND_MODE",
              "value": true
            }
          ]
        },
        {
          "type": "basic",
          "from": {
            "key_code": "g",
            "modifiers": {
              "mandatory": [
                "shift"
              ]
            }
          },
          "to_if_alone": [
            {
              "key_code": "down_arrow",
              "modifiers": [
                "option"
              ]
            }
          ],
          "conditions": [
            {
              "type": "frontmost_application_if",
              "bundle_identifiers": [
                "^com\\.apple\\.finder$"
              ]
            },
            {
              "type": "variable_unless",
              "name": "FINDER_INSERT_MODE",
              "value": true
            },
            {
              "type": "variable_unless",
              "name": "FINDER_FIND_MODE",
              "value": true
            }
          ]
        },
        {
          "type": "basic",
          "from": {
            "key_code": "j",
            "modifiers": {
              "mandatory": [
                "shift"
              ]
            }
          },
          "to": [
            {
              "key_code": "down_arrow"
            },
            {
              "key_code": "down_arrow"
            },
            {
              "key_code": "down_arrow"
            },
            {
              "key_code": "down_arrow"
            },
            {
              "key_code": "down_arrow"
            },
            {
              "key_code": "down_arrow"
            }
          ],
          "conditions": [
            {